{
  "$schema": "https://json-schema.org/draft/2020-12/schema",
  "$id": "extraction_review_data.schema.json",
  "title": "Extraction Review Data",
  "type": "object",
  "required": ["schema_version", "transaction_id", "run_id", "created_at", "source_manifest_hash", "payload"],
  "properties": {
    "schema_version": { "type": "string" },
    "transaction_id": { "type": "string" },
    "run_id": { "type": "string" },
    "created_at": { "type": "string" },
    "created_by": { "type": ["string", "null"] },
    "source_manifest_hash": { "type": "string" },
    "payload": { "type": "object" },
    "warnings": { "type": "array" },
    "errors": { "type": "array" }
  }
}
