{
  "schema_version": "1.0.0",
  "transaction_id": "TR-SMD-0000001",
  "run_id": "run-0001",
  "created_at": "2026-06-09T00:00:00Z",
  "created_by": null,
  "source_manifest_hash": "sha256-placeholder",
  "payload": {
    "status": "passed",
    "rule_profile": "sidwell_validation_v1",
    "rule_version": "1.0.0",
    "finding_counts": {
      "critical": 0,
      "high": 0,
      "warning": 0,
      "info": 1,
      "passed": 4
    },
    "findings": [
      {
        "rule_id": "approved_review_snapshot_current",
        "title": "Approved review snapshot matches the current review data.",
        "severity": "passed",
        "status": "passed",
        "evidence": "review_hash=sha256-placeholder",
        "recommended_action": null
      }
    ]
  },
  "warnings": [],
  "errors": []
}
