{
  "schema_version": "1.0.0",
  "transaction_id": "TR-SMD-0000001",
  "run_id": "run-0001",
  "created_at": "2026-06-09T00:00:00Z",
  "created_by": null,
  "source_manifest_hash": "sha256-placeholder",
  "payload": {
    "records": [],
    "extraction_method": "placeholder"
  },
  "warnings": [],
  "errors": []
}
